{
  "case_id": "fleet_09",
  "context_profile": "GOVERNED_CONTEXT_V1",
  "database_id": "fleet_ops",
  "provenance": {
    "authoring_source": "original",
    "external_benchmark_derived": false,
    "human_reviewed": false,
    "machine_authored": true
  },
  "question": "Match vehicles to telemetry using legacy device code and report the latest reading.",
  "task_type": "AUTHORITY_BLOCKED"
}
