{
  "case_id": "warehouse_20",
  "context_profile": "GOVERNED_CONTEXT_V1",
  "database_id": "warehouse_logistics",
  "provenance": {
    "authoring_source": "original",
    "external_benchmark_derived": false,
    "human_reviewed": false,
    "machine_authored": true
  },
  "question": "List late shipments.",
  "task_type": "AMBIGUOUS"
}
