{
  "case_id": "fleet_10",
  "context_profile": "GOVERNED_CONTEXT_V1",
  "database_id": "fleet_ops",
  "provenance": {
    "authoring_source": "original",
    "external_benchmark_derived": false,
    "human_reviewed": false,
    "machine_authored": true
  },
  "question": "Which vehicles were recently maintained?",
  "task_type": "AMBIGUOUS"
}
