{
  "case_id": "fleet_02",
  "context_profile": "GOVERNED_CONTEXT_V1",
  "database_id": "fleet_ops",
  "provenance": {
    "authoring_source": "original",
    "external_benchmark_derived": false,
    "human_reviewed": false,
    "machine_authored": true
  },
  "question": "For each vehicle home depot, return the rounded average fuel purchase cost, calculated as liters times price per liter for vehicles assigned to that depot. Return only the depot ID and its average cost, in that order.",
  "task_type": "ANSWERABLE"
}
