{
  "case_id": "subscription_10",
  "context_profile": "GOVERNED_CONTEXT_V1",
  "database_id": "subscription_billing",
  "provenance": {
    "authoring_source": "original",
    "external_benchmark_derived": false,
    "human_reviewed": false,
    "machine_authored": true
  },
  "question": "For each plan, return the plan ID and the refund rate, defined as refunded captured dollars divided by captured dollars. Include only groups represented by at least one qualifying source record.",
  "task_type": "ANSWERABLE"
}
