{
  "case_id": "subscription_09",
  "context_profile": "GOVERNED_CONTEXT_V1",
  "database_id": "subscription_billing",
  "provenance": {
    "authoring_source": "original",
    "external_benchmark_derived": false,
    "human_reviewed": false,
    "machine_authored": true
  },
  "question": "Return only invoice IDs that were open and past due on 2026-06-30.",
  "task_type": "ANSWERABLE"
}
