{
  "case_id": "fleet_01",
  "context_profile": "GOVERNED_CONTEXT_V1",
  "database_id": "fleet_ops",
  "provenance": {
    "authoring_source": "original",
    "external_benchmark_derived": false,
    "human_reviewed": false,
    "machine_authored": true
  },
  "question": "List telemetry event IDs and vehicle IDs where documented engine temperature is at least 100 Celsius. Return only the telemetry event ID and vehicle ID, in that order.",
  "task_type": "ANSWERABLE"
}
